{
    "$schema": "https://json-schema.org/draft/2020-12/schema",
    "description": "model.json describes a number of devices, typically lights, for use within the HomeAssistant Powercalc extension.",
    "type": "object",
    "required": [
        "name",
        "standby_power",
        "measure_method",
        "measure_device",
        "calculation_strategy"
    ],
    "properties": {
        "name": {
            "type": "string",
            "description": "The full name"
        },
        "standby_power": {
            "type": "number",
            "minimum": 0.05,
            "description": "Power draw when the device is turned off. When you are not able to measure set to 0.4 for lights"
        },
        "standby_power_on": {
            "type": "number",
            "minimum": 0.05,
            "description": "Power draw when the device is turned on."
        },
        "calculation_strategy": {
            "type": "string",
            "enum": [
                "lut",
                "linear",
                "fixed"
            ],
            "description": "Supported calculation modes"
        },
        "measure_method": {
            "type": "string",
            "enum": [
                "manual",
                "script"
            ],
            "description": "How the device was measured"
        },
        "measure_device": {
            "type": "string",
            "description": "Device which was used to measure"
        },
        "measure_description": {
            "type": "string",
            "description": "Add more information about how you measured the device or any remarks"
        },
        "measure_settings": {
            "type": "object",
            "description": "Settings used for measure script"
        },
        "linked_lut": {
            "type": "string",
            "description": "Use LUT data files from another model"
        },
        "device_type": {
            "type": "string",
            "enum": [
                "light",
                "smart_switch",
                "smart_speaker"
            ],
            "description": "Type of device"
        },
        "calculation_enabled_condition": {
            "type": "string",
            "description": "Template which can be evaluated."
        },
        "aliases": {
            "type": "array",
            "items": {
                "type": "string"
            },
            "description": "Aliases for this model"
        },
        "linear_config": {
            "type": "object",
            "description": "Configuration for linear calculation mode",
            "properties": {
                "min_power": {
                    "type": "number"
                },
                "max_power": {
                    "type": "number"
                },
                "calibrate": {
                    "type": "array",
                    "items": {
                        "type": "string"
                    }
                }
            }
        },
        "fixed_config": {
            "type": "object",
            "description": "Configuration for fixed calculation mode",
            "properties": {
                "power": {
                    "type": "number"
                },
                "states_power": {
                    "type": "object",
                    "description": "A dict of state attributes and the power. See https://github.com/bramstroker/homeassistant-powercalc#power-per-state.",
                    "properties": {
                        "idle": {
                            "type": [
                                "number",
                                "string"
                            ]
                        },
                        "playing": {
                            "type": [
                                "number",
                                "string"
                            ]
                        },
                        "paused": {
                            "type": [
                                "number",
                                "string"
                            ]
                        },
                        "off": {
                            "type": [
                                "number",
                                "string"
                            ]
                        },
                        "unavailable": {
                            "type": [
                                "number",
                                "string"
                            ]
                        }
                    },
                    "additionalProperties": {
                        "type": [
                            "number",
                            "string"
                        ]
                    }
                }
            }
        },
        "config_flow_discovery_remarks": {
            "type": "string",
            "description": "Some remarks to show in the GUI config flow on first step of discovery"
        },
        "sensor_config": {
            "type": "object",
            "description": "Sensor configuration options. See the README"
        },
        "sub_profile_select": {
            "type": "object",
            "description": "Configuration to automatically select a sub profile",
            "required": [
                "default",
                "matchers"
            ],
            "properties": {
                "default": {
                    "type": "string",
                    "description": "Default profile to select when non of the matchers apply"
                },
                "matchers": {
                    "type": "array",
                    "items": {
                        "type": "object",
                        "properties": {
                            "type": {
                                "enum": [
                                    "attribute",
                                    "entity_id",
                                    "entity_state"
                                ]
                            },
                            "attribute": {
                                "type": "string"
                            },
                            "map": {
                                "type": "object"
                            },
                            "pattern": {
                                "type": "string"
                            },
                            "profile": {
                                "type": "string"
                            }
                        },
                        "required": [
                            "type"
                        ]
                    },
                    "description": "List of matchers which will be checked"
                }
            }
        }
    }
}
