{
    "measure_description": "Measured with utils/measure script",
    "measure_device": "TP-Link Kasa KP115",
    "measure_method": "script",
    "measure_settings": {
        "SAMPLE_COUNT": 1,
        "SLEEP_TIME": 10,
        "VERSION": "v0.19.7"
    },
    "name": "Yeelight Smart LED Bulb II Color",
    "standby_power": 1.07,
    "calculation_strategy": "lut",
    "aliases": [
        "color2"
    ]
}
