{
    "name": "Hue White and Color Ambiance E14 Candle w/ BT",
    "standby_power": 0.28,
    "calculation_strategy": "lut",
    "aliases": [
        "929002294203"
    ],
    "measure_method": "script",
    "measure_device": "AVM FRITZ!DECT 200",
    "measure_description": "Measured with own custom script"
}
