{
    "calculation_strategy": "lut",
    "measure_description": "Measured with utils/measure script",
    "measure_device": "Shelly Plug S",
    "measure_method": "script",
    "measure_settings": {
        "SAMPLE_COUNT": 2,
        "SLEEP_TIME": 3,
        "VERSION": "v1.9.2:docker"
    },
    "name": "TRADFRI bulb E12/E14 WS globe 450/470 lumen, dimmable, white spectrum, opal white (LED2101G4)",
    "standby_power": 0.2,
    "aliases": [
        "TRADFRI bulb E14 WS globe 470lm"
    ]
}
