{
    "calculation_strategy": "lut",
    "measure_description": "Measured with utils/measure script",
    "measure_device": "TP-Link HS110",
    "measure_method": "script",
    "measure_settings": {
        "SAMPLE_COUNT": 2,
        "SLEEP_TIME": 6,
        "VERSION": "v1.9.11:docker"
    },
    "name": "TR\u00c5DFRI LED bulb E27 1055 lumen, smart wireless dimmable/white spectrum globe",
    "standby_power": 0.19
}