{
    "measure_description": "Measured with utils/measure script",
    "measure_device": "Shelly 1PM",
    "measure_method": "script",
    "measure_settings": {
        "SAMPLE_COUNT": 2,
        "SLEEP_TIME": 5,
        "VERSION": "v1.0.3:docker"
    },
    "name": "Smart Zigbee pro 12W A60 bulb",
    "standby_power": 0.5,
    "calculation_strategy": "lut"
}
