{
    "calculation_strategy": "lut",
    "measure_description": "Measured with utils/measure script",
    "measure_device": "TP-Link Tapo P110",
    "measure_method": "script",
    "measure_settings": {
        "SAMPLE_COUNT": 2,
        "SLEEP_TIME": 3,
        "VERSION": "v1.10.0:docker"
    },
    "name": "Livarno Lux E27 ST64 Filament Bulb",
    "standby_power": 0.3
}