{
    "measure_description": "Measured with utils/measure script",
    "measure_device": "Gosund SP111 with Tasmota",
    "measure_method": "script",
    "measure_settings": {
        "SAMPLE_COUNT": 2,
        "SLEEP_TIME": 3,
        "VERSION": "v0.22.0:docker"
    },
    "name": "Livarno Lux E27 filament bulb",
    "standby_power": 0.2,
    "calculation_strategy": "lut"
}