{
   "name":"Hue Calla Outdoor Pedestal",
   "standby_power":0.4,
   "calculation_strategy": "lut",
   "measure_device":"Gosund SP111 on Tasmota 9.5.0",
   "measure_description":"Measure Script for Tasmota",
   "measure_method":"script",
   "aliases": [
        "1742030P7",
        "8718696167991",
        "LCF001"
    ]
}
