{
    "calculation_strategy": "lut",
    "measure_description": "Measured with utils/measure script",
    "measure_device": "SONOFF S31",
    "measure_method": "script",
    "measure_settings": {
        "SAMPLE_COUNT": 2,
        "SLEEP_TIME": 3,
        "VERSION": "v1.3.13:docker"
    },
    "name": "Hue White Ambiance BR30 680lm WW Bulb",
    "standby_power": 0.25
}