{
    "calculation_strategy": "lut",
    "measure_description": "Measured with utils/measure script",
    "measure_device": "Shelly 1PM",
    "measure_method": "script",
    "measure_settings": {
        "SAMPLE_COUNT": 2,
        "SLEEP_TIME": 3,
        "VERSION": "master"
    },
    "name": "Hue White Ambiance Milliskin",
    "standby_power": 0.3,
    "aliases": [
        "929003045001_01",
        "929003045001_02",
        "929003045001_03"
    ]
}