{
    "measure_description": "Measured with utils/measure script",
    "measure_device": "Sonoff S31",
    "measure_method": "script",
    "measure_settings": {
        "SAMPLE_COUNT": 3,
        "SLEEP_TIME": 15,
        "VERSION": "v0.19.16:docker"
    },
    "name": "Smart Bulb Color E27",
    "standby_power": 0.11,
    "calculation_strategy": "lut"
}