{
    "calculation_strategy": "lut",
    "measure_description": "Measured with utils/measure script",
    "measure_device": "Tapo P110",
    "measure_method": "script",
    "measure_settings": {
        "SAMPLE_COUNT": 2,
        "SLEEP_TIME": 3,
        "VERSION": "master"
    },
    "name": "Mirabella 9W 750Lm RGBW Downlight",
    "standby_power": 0.24
}