{
    "calculation_strategy": "lut",
    "measure_description": "Measured with utils/measure script",
    "measure_device": "Nous A1T",
    "measure_method": "script",
    "measure_settings": {
        "SAMPLE_COUNT": 2,
        "SLEEP_TIME": 3,
        "VERSION": "v1.3.1:docker"
    },
    "name": "RB 148 T - E14 candle tuneable white",
    "standby_power": 0.48
}