{
    "measure_description": "Measured with utils/measure script",
    "measure_device": "Gosuna Smart Plug UP111 (via tuya)",
    "measure_method": "script",
    "measure_settings": {
        "SAMPLE_COUNT": 1,
        "SLEEP_TIME": 2,
        "VERSION": "v0.19.15:docker"
    },
    "name": "Hue White Ambiance E14 w/ BT",
    "standby_power": 0.2,
    "calculation_strategy": "lut",
    "aliases": [
        "9290022944"
    ]
}

