{
    "calculation_strategy": "lut",
    "measure_description": "Measured with utils/measure script",
    "measure_device": "NOUS A1T with ESPHome 2023.11.6",
    "measure_method": "script",
    "measure_settings": {
        "SAMPLE_COUNT": 2,
        "SLEEP_TIME": 3,
        "VERSION": "v1.9.5:docker"
    },
    "name": "NYMANE PENDANT",
    "standby_power": 0.29
}