{
    "measure_description": "Measured with utils/measure script",
    "measure_device": "TP-Link Tapo P110",
    "measure_method": "script",
    "measure_settings": {
        "SAMPLE_COUNT": 2,
        "SLEEP_TIME": 3,
        "VERSION": "v0.23.2:docker"
    },
    "name": "Arlec Smart R80 9.5W 806lm CCT Bulb",
    "standby_power": 0.58,
    "calculation_strategy": "lut"
}