{
    "calculation_strategy": "lut",
    "measure_description": "Measured with utils/measure script; 6.1 Watts dummy load",
    "measure_device": "Shelly Plus Plug S",
    "measure_method": "script",
    "measure_settings": {
        "SAMPLE_COUNT": 15,
        "SLEEP_TIME": 3,
        "VERSION": "v1.9.5:docker"
    },
    "name": "TRADFRI bulb E27 WW globe 806lm",
    "standby_power": 0.11,
    "aliases": [
        "TRADFRI bulb E27 WW globe 806lm"
    ]
}
