{
    "measure_description": "Measured with utils/measure script",
    "measure_device": "Wemo Insight F7C029uk",
    "measure_method": "script",
    "measure_settings": {
        "SAMPLE_COUNT": 1,
        "SLEEP_TIME": 2,
        "VERSION": "v0.17.0:docker"
    },
    "name": "LIFX Z",
    "standby_power": 0.57,
    "calculation_strategy": "lut"
}